{
  "case_id": "v2-005",
  "difficult": false,
  "expected_state": {
    "approval_checked": false,
    "catalog_evidence_id": "CAT-005",
    "quantity": 2,
    "region": "eu-west-1",
    "status": "blocked_unavailable"
  },
  "goal": "Deploy two canary instances in eu-west-1 only if the release artifact is available.",
  "initial_state": {
    "approval_granted": false,
    "catalog_status": "unavailable",
    "faulty_order": [
      "catalog.lookup",
      "fulfill.simulate"
    ],
    "faulty_quantity_arg": 2,
    "memory_region": "eu-west-1",
    "request_id": "REQ-7101",
    "requested_quantity": 2,
    "requested_region": "eu-west-1",
    "requires_approval": false
  },
  "scenario_family": "software_release_control",
  "split": "held_out",
  "tool_fixtures": {
    "approval.check": {
      "evidence_id": "APR-005",
      "granted": false
    },
    "catalog.lookup": {
      "evidence_id": "CAT-005",
      "region": "eu-west-1",
      "status": "unavailable"
    },
    "fulfill.simulate": {
      "side_effects": "sandboxed"
    }
  },
  "trajectory": [
    {
      "evidence_refs": [
        "request:REQ-7101"
      ],
      "index": 1,
      "kind": "request",
      "source": "release_manager",
      "step_id": "v2-005-s1",
      "summary": "REQ-7101 requests deployment of 2 canary instances to eu-west-1."
    },
    {
      "evidence_refs": [
        "CAT-005"
      ],
      "index": 2,
      "kind": "tool",
      "source": "catalog.lookup",
      "step_id": "v2-005-s2",
      "summary": "The release catalog returns status='unavailable' for the requested release artifact in eu-west-1."
    },
    {
      "evidence_refs": [
        "CAT-005"
      ],
      "index": 3,
      "kind": "interpretation",
      "source": "agent",
      "step_id": "v2-005-s3",
      "summary": "The unavailable catalog result is interpreted as permission to continue."
    },
    {
      "evidence_refs": [
        "CAT-005"
      ],
      "index": 4,
      "kind": "tool",
      "source": "fulfill.simulate",
      "step_id": "v2-005-s4",
      "summary": "A sandbox deployment of two canary instances is attempted."
    },
    {
      "evidence_refs": [
        "CAT-005"
      ],
      "index": 5,
      "kind": "final",
      "source": "agent",
      "step_id": "v2-005-s5",
      "summary": "The run reports the release as deployed."
    }
  ],
  "workflow_config": {
    "approval_rule": true,
    "enforce_order": true,
    "quantity_constraint": true,
    "require_evidence": true,
    "result_validation": false,
    "retrieval_filter": "current_request_region_only"
  }
}
