{
  "case_id": "v2-010",
  "difficult": false,
  "expected_state": {
    "approval_checked": false,
    "catalog_evidence_id": "CAT-010",
    "quantity": 5,
    "region": "us-east-1",
    "status": "fulfilled"
  },
  "goal": "Create five temporary sandbox access seats in us-east-1.",
  "initial_state": {
    "approval_granted": false,
    "catalog_status": "available",
    "faulty_order": [
      "catalog.lookup",
      "fulfill.simulate"
    ],
    "faulty_quantity_arg": 0,
    "memory_region": "us-east-1",
    "request_id": "REQ-7202",
    "requested_quantity": 5,
    "requested_region": "us-east-1",
    "requires_approval": false
  },
  "scenario_family": "data_access_control",
  "split": "held_out",
  "tool_fixtures": {
    "approval.check": {
      "evidence_id": "APR-010",
      "granted": false
    },
    "catalog.lookup": {
      "evidence_id": "CAT-010",
      "region": "us-east-1",
      "status": "available"
    },
    "fulfill.simulate": {
      "side_effects": "sandboxed"
    }
  },
  "trajectory": [
    {
      "evidence_refs": [
        "request:REQ-7202"
      ],
      "index": 1,
      "kind": "request",
      "source": "data_steward",
      "step_id": "v2-010-s1",
      "summary": "REQ-7202 requests 5 temporary sandbox access seats in us-east-1."
    },
    {
      "evidence_refs": [
        "CAT-010"
      ],
      "index": 2,
      "kind": "tool",
      "source": "catalog.lookup",
      "step_id": "v2-010-s2",
      "summary": "The entitlement catalog reports the access profile available in us-east-1."
    },
    {
      "evidence_refs": [
        "request:REQ-7202"
      ],
      "index": 3,
      "kind": "decision",
      "source": "agent",
      "step_id": "v2-010-s3",
      "summary": "The fulfillment argument is set to quantity=0 despite the explicit request for five seats."
    },
    {
      "evidence_refs": [
        "CAT-010"
      ],
      "index": 4,
      "kind": "tool",
      "source": "fulfill.simulate",
      "step_id": "v2-010-s4",
      "summary": "Sandbox fulfillment is called with quantity=0."
    },
    {
      "evidence_refs": [
        "CAT-010"
      ],
      "index": 5,
      "kind": "final",
      "source": "agent",
      "step_id": "v2-010-s5",
      "summary": "The run reports the seat request processed."
    }
  ],
  "workflow_config": {
    "approval_rule": true,
    "enforce_order": true,
    "quantity_constraint": false,
    "require_evidence": true,
    "result_validation": true,
    "retrieval_filter": "current_request_region_only"
  }
}
